{
  "artifact_paths": [
    "artifacts/capability_matrix_loop/CML15C_REBALANCE_SLOTS_30/samples/lifecycle_evidence_30.json",
    "artifacts/capability_matrix_loop/CML15C_REBALANCE_SLOTS_30/samples/operation_command_trace.jsonl",
    "artifacts/capability_matrix_loop/CML15C_REBALANCE_SLOTS_30/samples/workload_window_report_30.json",
    "artifacts/capability_matrix_loop/CML15C_REBALANCE_SLOTS_30/samples/cleanup_report_30.json",
    "artifacts/capability_matrix_loop/CML15C_REBALANCE_SLOTS_30/samples/operation_event.jsonl",
    "artifacts/capability_matrix_loop/CML15C_REBALANCE_SLOTS_30/samples/metrics_window.jsonl",
    "artifacts/capability_matrix_loop/CML15C_REBALANCE_SLOTS_30/samples/workload_window.jsonl",
    "artifacts/capability_matrix_loop/CML15C_REBALANCE_SLOTS_30/capability_matrix.json",
    "artifacts/capability_matrix_loop/CML15C_REBALANCE_SLOTS_30/analysis_summary.json"
  ],
  "blocking_findings": [],
  "decision": "PASS",
  "fresh_context": true,
  "gate_result_path": "artifacts/capability_matrix_loop/CML15C_REBALANCE_SLOTS_30/validation/current_stage_gate_result.json",
  "gate_result_sha256": "fd12dcff91e9594f61f31676f6fbc21b986f35aa172106abe21281935dfac3a4",
  "schema_version": "v1",
  "stage_id": "CML15C_REBALANCE_SLOTS_30"
}
